X1,LexikalischerFrame,KE1,KEE,KE2,Lesart,Schwierigkeit,Koerzion,No,Date,Genre,Bibl,ContextBefore,Hit,ContextAfter
klicken,Make_noise,Make_noise.Sound_source,Motion.Theme,Motion.Path,incidental,x,7,45,36559,Zeitung,"Die Zeit, 03.02.2000, Nr. 6","Man spricht vom Cyberspace, von virtuellen Räumen und Chatrooms, in denen Netzbewohner einander treffen.","Sie klicken sich durch Portale, orientieren sich an Sitemaps, immer auf der Suche nach der besten Adresse.","Diese räumliche Redeweise ist nicht erst mit den Bildern des World Wide Web aufgekommen; schon in der grafikfreien Frühzeit, als das Ganze noch Datenfernübertragung (DFÜ) hieß, in den frühen Achtzigern also, wurde von Datenreisen gesprochen und von Mailboxen, in denen man sich traf (also im Briefkasten!)."
bewegen,Motion,Motion.Theme,NA,Motion.Path,neutral,x,1,48,36566,Zeitung,"Die Zeit, 10.02.2000, Nr. 7","Was tat Agricola, dass man ihn, den Sänger der burgundischen Hofkapelle, eine ""triumphale Stimme"" nannte?","Er bewegte sich durch vermeintlich unauffällige harmonische Räume mit einer Sehnsucht nach Farbigkeit, die alle Grauwerte des Theoretischen löschte.",Der gute alte Hexachord-Raum der damaligen Musiklehre weitete sich unter Agricolas Lust an bizarren Linienführungen ins Verwegene.
bewegen,Motion,Motion.Theme,NA,Motion.Path,neutral,x,1,55,36573,Zeitung,"Die Zeit, 17.02.2000, Nr. 8","Hat Haiders Zwillingsbruder einen deutschen Pass, weil Sabine Christiansen mit ihm...","Die deutsche Seele ist bewegt, bewegt sich durch Berlin und findet sich nicht wieder.","Der Nebel der Silvesternacht, der alles Licht verschluckte, war ein Zeichen, das bis heute nicht verschwunden ist."
wühlen,Scouring,Scouring.Searcher,Motion.Theme,Motion.Path+Scouring.Ground,means,b,5,61,36573,Zeitung,"Die Zeit, 17.02.2000, Nr. 8",So konnte sich die asiatische Grippe flächendeckend ausbreiten.,"Von Jakarta bis Seoul - überall wühlen sich Wirtschaftsprüfer, Weltbanker und Experten des Internationalen Währungsfonds durch Bankbilanzen.",Nach dem großen Crash im Sommer 1997 sind zwar die Exporte wieder gewachsen und auch die Anleger nach Asien zurückgekehrt.
quälen,Cause_to_experience,Cause_to_experience.Agent,Motion.Theme+Cause_to_experience.Experiencer,Motion.Path,manner,a,6,66,36580,Zeitung,"Die Zeit, 24.02.2000, Nr. 9",Die neuen Reichen der Mongolei jagen in teuren S-Klasse-Limousinen über Schlaglöcher und fliegen mit dem Airbus der Miat zum Einkauf nach Berlin.,Für die neuen Armen in den heruntergekommenen Wohnblöcken der Städte ist jedoch keine Sozialhilfe da Rolf Knieper quält sich im Jeep durch die Wüste Turkmenistans und trinkt Wodka in mongolischen Partykellern.,Das gehört zum Job.
arbeiten,Work,Work.Agent,Motion.Theme,Motion.Path+Work.Salient_entity,means,b,5,67,36580,Zeitung,"Die Zeit, 24.02.2000, Nr. 9","""Herr Knieper, Sie sind doch Spezialist für Länder, von denen man nicht weiß, wo sie liegen?","Seitdem arbeitet sich der Professor acht Monate im Jahr mit einem Jeep durch die Wüste von Turkmenistan, harrt in Kasachstan stundenlang in ungeheizten Sitzungszimmern aus und bewahrt in Usbekistan auch nach dem sechsten Wodka noch die Contenance.","Doch an diesem Morgen im Parlamentssaal der Mongolei wünscht sich Knieper einen Moment lang in den deutschen Wissenschaftsbetrieb zurück, wo man Meinungsverschiedenheiten in Fachzeitschriften austrägt."
ergießen,Fluidic_motion,Fluidic_motion.Fluid,Fluid_motion.Fluid,Fluidic_motion.Path,neutral,x,1,71,36580,Zeitung,"Die Zeit, 24.02.2000, Nr. 9",Das Flutwasser war eine mit Cyanid versetzte Brühe zum Goldwaschen.,"Sie hatte den Damm eines Speichersees durchbrochen, ergoss sich durch den Feldkanal in die Lapus, von der Lapus in die Somes und von der Somes jenseits der ungarischen Grenze in die Theiß.",Auf ihrer gemächlichen Bahn flussab tötete die Giftbrühe dort jedes Leben.
wühlen,Scouring,Scouring.Searcher,Motion.Theme,Motion.Path+Scouring.Ground,means,b,5,72,36580,Zeitung,"Die Zeit, 24.02.2000, Nr. 9","Schläuche, Stahlrohre und Pumphähne liegen herum.","Lastwagen wühlen sich durch das weiche Erdreich, kippen ockerbraunen Sand obenauf.","Auf einem Schild an der Einfahrt steht: ""Aktiver Schlamm."
quälen,Cause_to_experience,Cause_to_experience.Agent,Motion.Theme+Cause_to_experience.Experiencer,Motion.Path,manner,a,6,73,36580,Zeitung,"Die Zeit, 24.02.2000, Nr. 9",Feuchte Kälte schlägt aus der dunklen Zelle.,"Eine Ahnung von Licht quält sich durch ein briefbogengroßes, verdrecktes Fenster.",Von den Pritschen schrecken vier Gefangene hoch.
quälen,Cause_to_experience,Cause_to_experience.Agent,Motion.Theme+Cause_to_experience.Experiencer,Motion.Path,manner,a,6,97,36601,Zeitung,"Die Zeit, 16.03.2000, Nr. 12",Aus der semantischen Kindheitskatastrophe folgen alle anderen.,Die Emanzipationswaisen werden zu egoistischen Monstern und quälen sich mit begrenzter Libido durch bretonische Swinger-Clubs.,"Auf ihrer Partnerpirsch reden sie viel und bleiben doch stumm, obwohl es nur einer winzigen Geste, eines einzigen Wortes bedürfte, damit sie von der Frau ihres Lebens erkannt würden und der Partisanenkrieg der Geschlechter ein Ende hätte."
schieben,Cause_motion,Cause_motion.Agent,Cause_motion.Theme,Cause_motion.Path,neutral,b,1,102,36601,Zeitung,"Die Zeit, 16.03.2000, Nr. 12","""Ich bin der Überzeugung, dass die Frau Doktor Merkel Kompetenz und...""","Auf einmal steigt von draußen der Stimmenpegel an, Fotografen hetzen herein, ein dichter Pulk dunkel gekleideter Männer schiebt sich wie ein Rammblock durch die Masse.","Am Podium angekommen, wird Angela Merkel sichtbar, sie steigt rechts die wenigen Stufen festen Schrittes herauf, während links Wolfgang Schäuble die kleine Rampe hochrollt, in großer Anstrengung."
schlängeln,Motion,Motion.Theme,NA,Motion.Path,manner,x,1,109,36607,Gebrauchsliteratur,"o. A. [kago]: Jordan. In: Aktuelles Lexikon 1974-2000, München: DIZ 2000 [2000]","Der Jordan, natürliche Grenze und tiefstgelegener Fluss der Erde, ist ein Symbol religiöser und politischer Natur.","Er schlängelt sich vom Hermon-Gebirge zum See Genezareth und zum Toten Meer, durch ein Gebiet, das unter ständiger Trockenheit leidet.",Israel und die arabischen Nachbarn streiten sich immer wieder um die Nutzung des Wassers.
bewegen,Motion,Motion.Theme,NA,Motion.Path,neutral,x,1,112,36608,Zeitung,"Die Zeit, 23.03.2000, Nr. 13","Er muss die verschwiegenen Krisenzeichen lesen, die stillen Erdbebenstöße, die unterirdisch heranschleichende Katastrophe, wie ein Voyeur sich hineinsaugen lassen in diese fremden, nahen Schicksale.",Aber auch Carvers Figuren bewegen sich als Voyeure durch ihre Welt.,"Immer wieder fällt ihr Blick durch Fenster, in fremde Wohnräume, in eine auch fremde Natur, erfassen Ausschnitte, die an Hoppers unheimliche Stillleben des amerikanischen Alltags erinnern."
steuern,Ride_vehicle,Ride_vehicle.Theme,Ride_vehicle_Vehicle,Ride_vehicle.Path,neutral,x,1,125,36615,Zeitung,"Die Zeit, 30.03.2000, Nr. 14",Es gibt nur einen Raum.,"Meine Seele ist eine Hülle, in der ich als Pilotin in der Seelenmitte sitze, und ich steuere mich durch diesen Raum, den ich einst ausgefüllt habe und noch weiter ausfüllen werde.","Ich stelle meine physische Existenz wieder her: Aus tausenden Scheibchen fügte sich in Sekundenschnelle wieder zusammen, was eben noch eine zerrissene, blutige Masse war."
schieben,Cause_motion,Cause_motion.Agent,Cause_motion.Theme,Cause_motion.Path,neutral,cx,1,128,36615,Zeitung,"Die Zeit, 30.03.2000, Nr. 14",Von einer kleinen Ebene aus Vulkangestein blicken wir auf den gegen überliegenden Hang.,"Drei Elefanten schieben sich dort gemächlich durch die Sträucher und hinterlassen ihre kugeligen Haufen, während im Hintergrund die Gipfel des Mount Kenya langsam in den Wolken verschwinden.",Urlaub in Afrika.
fressen,Ingestion,Ingestion.Ingestor,Motion.Theme,Motion.Path+Ingestion.Ingestibles,means,cx,5,129,36615,Zeitung,"Die Zeit, 30.03.2000, Nr. 14","Doch es war nicht etwa die Gunst der Lage, die den ganz großen Segen brachte - es war die Reblaus.",Die nämlich erreichte im 18. Jahrhundert mit einem aus Amerika kommenden Schiff die französische Küste und fraß sich unbarmherzig durch die französischen Weinäcker.,Erst die steil aufragenden Pyrenäen vermochten dem Vormarsch des Insekts Einhalt zu gebieten.
kloppen,Hostile_encounter,Hostile_encounter.Side_1,Motion.Theme,Motion.Path,incidental,c,7,134,36622,Zeitung,"Die Zeit, 06.04.2000, Nr. 15","Eher Schellack, AC/ DC oder Helmet als Blumfeld, Tocotronic und die Sterne.","Im Video zu Berlin liebt dich kloppen sich Surrogat in bester Tatort-Manier durch die Großstadt und parodieren nebenbei noch den Beastie-Boys-Clip-Klassiker Sabotage: Patrick unverschämt grinsend im Fitness-Studio, Mai-Linh schwer bewaffnet und gefährlich als Martial Artist, Tilo als smoother Supercop.",Ohne Humor geht es nicht.
arbeiten,Work,Work.Agent,Motion.Theme,Motion.Path+Work.Salient_entity,means,b,5,136,36622,Zeitung,"Die Zeit, 06.04.2000, Nr. 15","Höber saß in Recklinghausen, maß mit einem Lineal im Stadtplan von Manhattan Entfernungen auf dem Broadway.","Arbeitete sich durch ein 14 Pfund schweres Handbuch, das er vom FBI aus Washington erhalten hatte (für die 70 Mark Luftfracht musste er seine Wirtin anpumpen), und schrieb ganz wie sein Vorbild Karl May über ein Land, das er nie mit eigenen Augen gesehen hatte.","Erst 1970 reiste Höber nach New York, auf Einladung der Gewerkschaft der Polizei."
zwängen,Manipulation,Manipulation.Agent,Motion.Theme+Manipulation.Entity,Motion.Path,means,a,6,143,36629,Zeitung,"Die Zeit, 13.04.2000, Nr. 16",Termin im Asylbewerberheim Birkenweg.,"Der Ministerpräsident zwängt sich samt Tross durch die kahlen Betonkavernen, sieht die armen Betten dicht an dicht, dazu die Notmatratze.","Sagt: Ja, das ist ja in der Tat sehr eng, ja."
juxen,Prevarication,Prevarication.Speaker,Motion.Theme,Motion.Path,incidental,x,7,160,36643,Zeitung,"Die Zeit, 27.04.2000, Nr. 18","Zum Küssen die burgtheatralische Schmierlapperei Gerd Böckmanns (als Weichei-Lüstling Gianettino) und ganz herrlich Sven-Eric Bechtolf als Fiesco: ein abgefuckt verlotterter Drahtzieher, der Drähte und Puppen verwirrt und seine Sprache verheddert, mal sächsisch, mal bayerisch, mal bloß im Silbensalat gurgelt, ein Schlurf und Nichtsnutz - wie kann der eine Verschwörung leiten?","Niemand hier kann was Konkretes, alle wurschteln bloß rum, saugen Comedy aus der Tragödie, albern in Wortspielen, juxen sich durch Schillerbrocken und Kantinenwitze, mal mühsam, mal spaßig, immer bemüht - und manchmal führt das Bemühen zu Erfolgen, und man sieht ein, dass alle politischen Ränke nur von der Gier ""auf irgendwas"" angetrieben und nur durch Gehirnleere der Menschen ermöglicht werden.",Die Aufführung krankt jedoch an ihrer rasch zu durchschauenden Mechanik des Beliebigen.
schieben,Cause_motion,Cause_motion.Agent,Cause_motion.Theme,Cause_motion.Path,neutral,x,1,162,36643,Zeitung,"Die Zeit, 27.04.2000, Nr. 18",Blinjski Kut Kroaten und Serben im Dorf hat niemand gefragt.,Die Grenze schob sich einfach quer durch Blinjski Kut.,"Das schöne Haus lag auf der Seite der Separatisten, in der Serbischen Republik Krajina, die sich von Kroatien abgespalten hatte, aber von keinem Staat anerkannt wurde."
drängen,Self_motion,Self_motion.Self_mover,NA,Self_motion.Path,manner,b,1,189,36892,Belletristik,"Hettche, Thomas: Der Fall Arbogast, Köln: DuMont Buchverlag, 2001, S. 258",«Ja.«,"Paul nickte Gesine zu, die ihre Kamera fest mit beiden Händen hielt, aus dem Nicken wurde eine Art wortloser Gruß, und er drängte sich durch den Journalistenpulk in das Amtsgericht hinein.","Gesine blieb, wo sie war, machte einige Bilder und wartete, bis wenig später der weiße Mercedes von Ansgar Klein auf dem reservierten Parkplatz hielt und Arbogast und sein Anwalt ausstiegen."
arbeiten,Work,Work.Agent,Motion.Theme,Motion.Path+Work.Salient_entity,means,b,5,196,36892,Belletristik,"Pressler, Mirjam: Malka Mai, Weinheim Basel: Beltz & Gelberg 2001, S. 269","Er hielt ihren rechten Zopf so fest, dass Malkas Kopf zur Schulter gezogen wurde.","Sie hörte das knarrende Geräusch, als die Scherenblätter aufgingen, spürte das Metall an ihrem Hals und dann arbeitete sich die Schere säbelnd und schabend durch ihren Zopf.","Das war ein Rucken und Zerren, so dass Malka das Gefühl hatte, es würde ihr der Kopf vom Hals gerissen."
schleppen,Bringing,Bringing.Agent,Bringing.Theme,Bringing.Path,manner,a,1,215,37257,Belletristik,"Kopetzky, Steffen: Grand Tour, Frankfurt am Main: Eichborn 2002, S. 43",Pardell wollte nicht von seinen Erlebnissen und seinem Scheitern erzählen.,"Gegen 21 Uhr gab Pardell Salat noch einmal fünfzig Mark »für Nachschub schnell«, rang während Salats Abwesenheit mit Übelkeit, nickte auf der schlauchartigen Toilette ein, erwachte drei Stunden später, schleppte sich durch die menschenleere Wohnung in sein Zimmer, schlief in seinen Kleidern ein und bemerkte nicht, wie sich der völlig besoffen zurückgekehrte Salat gegen 7 Uhr harsch eines Großteils der Bettdecke bemächtigte und es sich in der Pardellschen Wärme gemütlich machte.","Am nächsten Tag war Pardell zitternd aufgewacht und hatte über seinen neuen Mitbewohner Salat gelächelt, der im Suff offensichtlich in das falsche Zimmer gegangen war."
quetschen,Manipulation,Manipulation.Agent,Motion.Theme+Manipulation.Entity,Motion.Path,means,a,6,221,37257,Belletristik,"Kopetzky, Steffen: Grand Tour, Frankfurt am Main: Eichborn 2002, S. 283",Alles klar? «,Die Babylonier nickten und quetschten sich ungelenk durch die Glastür auf die Steinstraße.,"Der Intelligenteste war sauer, die anderen beiden waren sehr froh, daß jener jetzt naturgemäß den Scheiß auswendig lernen durfte."
bewegen,Motion,Motion.Theme,NA,Motion.Path,neutral,x,1,226,37257,Belletristik,"Kopetzky, Steffen: Grand Tour, Frankfurt am Main: Eichborn 2002, S. 714","Das Zeug irgendwo loswerden, wo ihn niemand beobachten konnte.","Nachdem er ausgestiegen war, bewegte sich Pardell aufmerksam und schnell durch den dichten Schneefall auf dem Paß.","Es war ziemlich kalt, aber nicht so kalt, als daß er nicht zuerst nach der nächsten Verbindung Richtung München gesucht hätte."
zwängen,Manipulation,Manipulation.Agent,Motion.Theme+Manipulation.Entity,Motion.Path,means,a,6,227,37257,Belletristik,"Kopetzky, Steffen: Grand Tour, Frankfurt am Main: Eichborn 2002, S. 725","Der Fahnder rührte sich nicht vom Fleck, sondern lachte nur schallend.","Dann ließ er Bechthold stehen, zwängte sich durch die Gruppe wahnsinnig Gewordener, kam auf den Würger zu, gab ihm fröhlich die Hand und sagte:","»Ah, der Herr Baron."
stoßen,Cause_motion,Cause_motion.Agent,Cause_motion.Theme,Cause_motion.Path,neutral,x,1,232,37257,Belletristik,"Kuckart, Judith: Lenas Liebe, Köln: DuMont Literatur und Kunst Verlag 2002, S. 182","Nein, Mama.",Kunden mit letzten Geschenken stießen sich gegenseitig durch die Gänge.,Von überall her schrien Kinder.
entfernen,Departing,Departing.Theme,NA,Departing.(Path),neutral,x,1,234,37257,Belletristik,"Kuckart, Judith: Lenas Liebe, Köln: DuMont Literatur und Kunst Verlag 2002, S. 262","Und kommt er dir dann verändert vor, dann bin ich es gewesen.","Martina entfernte sich durch den Regen, aber ihre Haare wurden nicht naß, während sie endlich ging.",Noch immer zog diese esoterische Musik ihre Schleifen durch Ludwigs Zimmer.
quälen,Cause_to_experience,Cause_to_experience.Agent,Motion.Theme+Cause_to_experience.Experiencer,Motion.Path,manner,a,6,264,37622,Belletristik,"Bach, Tamara: Marsmädchen, Hamburg: Verlag Friedrich Oetinger 2003, S. 40","Vielleicht ist das wie bei anderen, die die Zunge aus dem Mund hängen lassen, nur ohne die Spuckefäden.","Phillip redet darüber, wie blöd ein Buch war, das er gelesen hat: »... und ich hab mich durch dreihundertzweiundfünfzig Seiten gequält und danach konnte ich einfach nur sagen: ›Ach, und das war's?",Das soll schon alles gewesen sein? ‹
schieben,Cause_motion,Cause_motion.Agent,Cause_motion.Theme,Cause_motion.Path,neutral,b,1,267,37622,Belletristik,"Bach, Tamara: Marsmädchen, Hamburg: Verlag Friedrich Oetinger 2003, S. 59",Sie schleppt mich zur Bar und schiebt uns beide durch die Menge.,"Laura ist ganz klein, sogar noch ein paar Zentimeter kleiner als ich, aber sie schiebt sich durch die Menge wie ein Türsteher.",Wir finden einen Platz direkt an der Theke und sie winkt den Barmann zu sich.
schieben,Cause_motion,Cause_motion.Agent,Cause_motion.Theme,Cause_motion.Path,neutral,b,1,268,37622,Belletristik,"Bach, Tamara: Marsmädchen, Hamburg: Verlag Friedrich Oetinger 2003, S. 105",Ich stehe wieder auf und suche Laura.,"Ich schiebe mich durch das Gewühl, sehe Suse einen küssen, kann aber sein Gesicht nicht sehen.","Auf der Tanzfläche ist sie nicht, an der Bar nicht, nicht auf dem Klo, nirgendwo, dann laufe ich wieder nach draußen."
drängeln,Cause_motion,Cause_motion.Agent,Cause_motion.Theme,Cause_motion.Path,manner,b,1,269,37622,Belletristik,"Bach, Tamara: Marsmädchen, Hamburg: Verlag Friedrich Oetinger 2003, S. 132","»Phillip, du holst die Getränke, du bist der Größte«, bestimmt Laura.",Phillip drängelt sich durch die Menge.,"Laura schaut ihm nach, dann nimmt sie mich plötzlich ganz fest in den Arm und sagt: »Schön, dass du mitgekommen bist.«"
bewegen,Motion,Motion.Theme,NA,Motion.Path,neutral,x,1,270,37622,Belletristik,"Braun, Marcus: Hochzeitsvorbereitungen, Berlin: Berlin Verlag 2003, S. 86",Gegen sieben ziehe ich mich an.,"Ich bewege mich durch die Wohnung, es ist warm.","Menschen, die psychisch labil sind, sollten sich auch in gut geheizten Wohnungen aufhalten."
schleichen,Self_motion,Self_motion.Self_mover,NA,Self_motion.Path,manner,a,1,273,37622,Belletristik,"Dölling, Beate: Hör auf zu trommeln, Herz, Weinheim: Beltz & Gelberg 2003, S. 28",Die Küchenuhr und der Regulator im Wohnzimmer tickten nicht im selben Takt.,Katharina schlich sich oben durch den Flur und kletterte die Leiter zum Dachboden hinauf.,Wie lange hatte sie hier schon nicht mehr gesessen?
drängeln,Cause_motion,Cause_motion.Agent,Cause_motion.Theme,Cause_motion.Path,manner,b,1,274,37622,Belletristik,"Dölling, Beate: Hör auf zu trommeln, Herz, Weinheim: Beltz & Gelberg 2003, S. 59",Sein linkes Auge zuckte und das schmale Gesicht war hinter einem dunklen Bartschatten verborgen.,Katharina drängelte sich durch die Leute.,"Sie stellte sich vor Armand, aber nicht zu nah an die Bühne."
schlängeln,Motion,Motion.Theme,NA,Motion.Path,manner,x,1,275,37622,Belletristik,"Dölling, Beate: Hör auf zu trommeln, Herz, Weinheim: Beltz & Gelberg 2003, S. 66",Nun hatte er sich auch noch wegen ihr besoffen!,Der Schmerz kam wieder und schlängelte sich durch den wunden Körper.,"»Katharina, what happened?«"
quälen,Cause_to_experience,Cause_to_experience.Agent,Motion.Theme+Cause_to_experience.Experiencer,Motion.Path,manner,a,6,277,37622,Belletristik,"Dölling, Beate: Hör auf zu trommeln, Herz, Weinheim: Beltz & Gelberg 2003, S. 126","Ausgerechnet jetzt, wo Katharina einen Brief von Armand so dringend braucht, kommt keiner.",Sie quält sich durch die Tage.,"In der Praxis war die ganze Woche Hochbetrieb – lauter Herz- und Kreislaufpatienten –, weil es plötzlich heiß geworden ist, von heute auf morgen."
drängeln,Cause_motion,Cause_motion.Agent,Cause_motion.Theme,Cause_motion.Path,manner,b,1,279,37622,Belletristik,"Dölling, Beate: Hör auf zu trommeln, Herz, Weinheim: Beltz & Gelberg 2003, S. 136","Jetzt spielen sie ein Stück, das sie schon öfter bei Radio Fritz gehört hat, aber sie weiß nicht, von wem es ist.","Sie rutscht von der Fensterbank, tritt die Kippe aus und drängelt sich durch den Saal durch.","Zur Theke, Köppke fragen."
schlängeln,Motion,Motion.Theme,NA,Motion.Path,manner,x,1,288,37622,Belletristik,"Franck, Julia: Lagerfeuer, Köln: DuMont Literatur und Kunst Verlag 2003, S. 256","Vorne wurde die Straße erweitert, und eine Baustellenampel hielt den Verkehr auf.","Ich schlängelte mich durch die Autos und die Abgase, die rot zwischen den Schlußlichtern dampften, und entdeckte gerade noch rechtzeitig die kräftige Gestalt von John Bird hinter dem erleuchteten Schaufenster.",Vermutlich hatte er Pause oder Feierabend und kaufte sich eine Fernsehzeitung.
schubsen,Cause_motion,Cause_motion.Agent,Cause_motion.Theme,Cause_motion.Path,manner,x,1,290,37622,Belletristik,"Franck, Julia: Lagerfeuer, Köln: DuMont Literatur und Kunst Verlag 2003, S. 297",Manche Kinder sangen ein kurzes Lied.,"Katja und Aleksej schubsten sich gegenseitig durch die Reihe, um anzukommen, aber nicht als erster.","Doreen wartete noch eine Weile und ging dann mit schwerfälligen Schritten wenige Meter vor, sie blieb längere Zeit die letzte in der langen Schlange, die bis ans hintere Ende des Saals reichte."
stehlen,Self_motion,Self_motion.Self_mover,NA,Self_motion.Path,manner,x,1,293,37622,Belletristik,"Funke, Cornelia: Tintenherz, Hamburg: Cecilie Dressler Verlag 2003, S. 94","Leise schlich sie die Treppe hinunter, in der einen Hand die Tasche, in der anderen den Zettel für Elinor.","Die Morgensonne stahl sich schon durch die Ritzen der Fensterläden, aber in dem großen Haus war es so still, als schliefen selbst die Bücher in den Regalen.",Nur durch die Tür von Elinors Schlafzimmer drang ein leises Schnarchen.
bewegen,Motion,Motion.Theme,NA,Motion.Path,neutral,cx,1,317,37987,Belletristik,"Düffel, John von: Houwelandt, Köln: DuMont Literatur und Kunst Verlag 2004, S. 128","»B. Gerber« stand auf dem Klingelbrett neben der Haustür, so als hätte es schon immer dort gestanden, was Esther vielleicht deshalb so vorkam, weil sie ihre Schwiegertochter nach der Trennung beinahe häufiger besucht hatte als zu der Zeit, in der Thomas noch hier lebte.","Die Indianerin bewegte sich in ihren flachen Schuhen beinahe geräuschlos durch das Treppenhaus, während die Badelatschen immer lauter gegen Esthers Hacken schlappten.","Wenn sie den Fuß auf das Linoleum setzte, knirschte der in das Schaumgummi eingetretene Sand."
quälen,Cause_to_experience,Cause_to_experience.Agent,Motion.Theme+Cause_to_experience.Experiencer,Motion.Path,manner,a,6,318,37987,Belletristik,"Düffel, John von: Houwelandt, Köln: DuMont Literatur und Kunst Verlag 2004, S. 137",»Du wolltest doch die ganze Zeit noch nicht nach Hause!«,»Ich sitze hier von morgens bis abends am Schreibtisch und quäle mich durch eine Akte nach der anderen.,Ich muß auch mal unter Leute! «
schieben,Cause_motion,Cause_motion.Agent,Cause_motion.Theme,Cause_motion.Path,neutral,x,1,319,37987,Belletristik,"Düffel, John von: Houwelandt, Köln: DuMont Literatur und Kunst Verlag 2004, S. 221","Wenn es so weitergoß, drohte der gesamte Hang abzurutschen und den Garten in eine Schlammlawine zu verwandeln.","Ein immer mächtiger werdender Strom von Erde schob sich durch das Tal, fraß an den Rändern des Grundstücks und dem vor der Sonne geretteten Grün.",Doch Jorge setzte sich nur langsam in Bewegung.
zwängen,Manipulation,Manipulation.Agent,Motion.Theme+Manipulation.Entity,Motion.Path,means,a,6,325,37987,Belletristik,"Suter, Martin: Lila, Lila, Zürich: Diogenes 2004, S. 11",Er war dreiundzwanzig.,"Er kaute sein Sandwich und zwängte sich durch den mit Möbeln, Kisten, Haushaltsgeräten, Büchern, Bilderrahmen, Nippes und anderem Krempel vollgepferchten Laden.","Ein paarmal hatte er hier schon etwas für Tobias gefunden, den Besitzer des Esquina, wo David arbeitete."
kämpfen,Hostile_encounter,Hostile_encounter.Side_1,Motion.Theme,Motion.Path,incidental,a,7,327,37987,Belletristik,"Suter, Martin: Lila, Lila, Zürich: Diogenes 2004, S. 47","Weshalb sie dennoch schon am nächsten Abend beinahe wieder hingegangen wäre, lag an ihrer Mutter Myrtha.","Marie saß seit dem späten Nachmittag an ihrem kleinen Schreibtisch in ihrem Zimmer und kämpfte sich durch Theodor Fontanes Der Stechlin, über den sie eine Arbeit schreiben mußte.","Als sie kurz nach vier von der Schule heimgekommen war, war Myrtha noch in ihrem Zimmer gewesen."
kämpfen,Hostile_encounter,Hostile_encounter.Side_1,Motion.Theme,Motion.Path,incidental,a,7,328,37987,Belletristik,"Suter, Martin: Lila, Lila, Zürich: Diogenes 2004, S. 52","Freitag, und dazu noch die zweitletzte Woche vor Weihnachten.","David kämpfte sich durch das überfüllte Lokal und reduzierte seinen Wortschatz auf: Moment, gleich, Sekunde, bin schon da und sofort.","Von weitem mußte er mit ansehen, wie gelöst Marie in Ralphs Gegenwart wurde."
kämpfen,Hostile_encounter,Hostile_encounter.Side_1,Motion.Theme,Motion.Path,incidental,a,7,330,37987,Belletristik,"Suter, Martin: Lila, Lila, Zürich: Diogenes 2004, S. 71","Sie fand eine CD, die sie nicht an Weihnachten erinnerte, und legte sich auf ihren Futon.","Sie kämpfte sich ein paar Seiten durch den Stechlin und griff auf der Suche nach dem erstbesten Vorwand, abzuschweifen, und auch, weil er sie heute wieder so erwartungsvoll angeschaut hatte, nach Davids Manuskript.","Es lag noch immer auf dem Regal, wo sie es vor vier Tagen hingelegt hatte."
drängen,Self_motion,Self_motion.Self_mover,NA,Self_motion.Path,manner,b,1,333,37987,Belletristik,"Suter, Martin: Lila, Lila, Zürich: Diogenes 2004, S. 344","David hoffte, er würde nicht gezwungen sein, hier wieder Kellner zu werden.","Er drängte sich so weit durch die Leute, daß er Ralphs Stammplatz sehen konnte.","Alle waren sie da, als wäre die Zeit stehengeblieben."
schlagen,Impact,Impact.Impactor,Motion.Theme,Motion.Path+Impact.Impactee,means,a,5,335,37987,Belletristik,"Widmer, Urs: Das Buch des Vaters, Zürich: Diogenes 2004, S. 153",»Was ist mit den Steuerbehörden?«,"– Der Vater schlug sich durch die Haus- und Gartentür, die danach, und für Jahre, schräg in den Angeln hing.",Es war dunkel.
